source_url,target_url,anchor_text,alt_text,nofollow,path_type
"https://campbellwindowfilm.com/locations-served/anaheim/window-tinting/","https://campbellwindowfilm.com/services/decorative-window-film/","Facade Re-Imaging Anaheim has a substantial inventory of aging commercial buildings along its major corridors whose exteriors no longer reflect the quality of the businesses inside. Facade re-imaging applies specialty surface films to update the building's street-facing appearance without the cost or timeline of structural renovation.","","false","4"
"https://campbellwindowfilm.com/locations-served/anaheim/window-tinting/","https://campbellwindowfilm.com/services/decorative-window-film/","Colored Window Film Hotels, entertainment venues, and retail operators in Anaheim use colored window film to extend brand identity onto building glass and differentiate their properties from neighboring competitors. Options span a broad range of tones and finishes for both commercial and residential applications.","","false","4"
"https://campbellwindowfilm.com/locations-served/anaheim/window-tinting/","https://campbellwindowfilm.com/services/decorative-window-film/","Switchable Film Conference centers, medical offices, and hospitality suites throughout Anaheim benefit from switchable film that turns glass from clear to private on demand. The technology eliminates the need for blinds or partition walls in rooms that need to shift between open and closed functions throughout the day.","Switchable films for offices","false","4"
"https://campbellwindowfilm.com/locations-served/anaheim/window-tinting/","https://campbellwindowfilm.com/services/decorative-window-film/","Decorative Window Film Decorative film adds pattern, texture, and privacy to glass without blocking light. It is a practical and cost-effective choice for Anaheim hotel lobbies, conference rooms, restaurant partitions, boutique retail spaces, and residential bathrooms, where design and function must work together.","Decorative Window Film","false","4"
"https://campbellwindowfilm.com/locations-served/anaheim/window-tinting/","https://campbellwindowfilm.com/services/decorative-window-film/","Custom Graphics Anaheim businesses competing for foot traffic in one of California's busiest tourism and entertainment markets rely on clear, compelling visual branding. We design and install large-format graphics on storefront glass, interior walls, and architectural surfaces for hotels, retail brands, restaurants, and venue operators throughout the city.","Custom graphics installed outside","false","4"
"https://campbellwindowfilm.com/locations-served/anaheim/window-tinting/","https://campbellwindowfilm.com/services/decorative-window-film/","Architectural Resurfacing The older commercial inventory throughout Anaheim includes many buildings with aging or discolored glass that undermines both curb appeal and thermal performance. Architectural resurfacing film improves the appearance and performance of existing glass surfaces without the disruption or expense of full-panel replacement.","Person picking up","false","4"
"https://campbellwindowfilm.com/locations-served/huntington-beach/window-tinting/","https://campbellwindowfilm.com/services/decorative-window-film/","Facade Re-Imaging Huntington Beach has a notable inventory of older commercial buildings along PCH and its inland corridors whose facades no longer reflect the caliber of the businesses inside. Facade re-imaging applies specialty surface films to modernize street presence without the timeline or cost of structural renovation.","","false","4"
"https://campbellwindowfilm.com/locations-served/huntington-beach/window-tinting/","https://campbellwindowfilm.com/services/decorative-window-film/","Colored Window Film Surf brands, beachside restaurants, and retail operators in Huntington Beach use colored window film to reinforce visual identity on storefront and building glass. Options cover a wide range of tones and finishes suited to both commercial and residential coastal applications.","","false","4"
"https://campbellwindowfilm.com/locations-served/huntington-beach/window-tinting/","https://campbellwindowfilm.com/services/decorative-window-film/","Switchable Film Medical offices, conference rooms, and hospitality spaces throughout Huntington Beach benefit from switchable film that shifts glass from fully transparent to private on demand. The technology eliminates the need for blinds or fixed partitions in rooms that must serve both open and private functions throughout the workday.","Switchable films for offices","false","4"
"https://campbellwindowfilm.com/locations-served/huntington-beach/window-tinting/","https://campbellwindowfilm.com/services/decorative-window-film/","Decorative Window Film Decorative film adds texture, pattern, and privacy to glass without reducing natural light. It is a practical solution for Huntington Beach restaurants, beachside offices, hotel lobbies, boutique retail spaces, and residential bathrooms where design and function are equally important.","Decorative Window Film","false","4"
"https://campbellwindowfilm.com/locations-served/huntington-beach/window-tinting/","https://campbellwindowfilm.com/services/decorative-window-film/","Custom Graphics Huntington Beach businesses depend on a strong visual identity to stand out in a competitive coastal retail and dining market. We design and install large-format custom graphics on storefront glass, interior walls, and architectural surfaces for surf brands, restaurants, hotels, and retail operators throughout the city and along PCH.","Custom graphics installed outside","false","4"
"https://campbellwindowfilm.com/locations-served/huntington-beach/window-tinting/","https://campbellwindowfilm.com/services/decorative-window-film/","Architectural Resurfacing Older commercial buildings along Huntington Beach's coastal corridors often have weathered or discolored glass that diminishes street presence and thermal performance. Architectural resurfacing film refreshes the appearance and improves the performance of existing glass surfaces without the cost or disruption of full-panel replacement.","Person picking up","false","4"
"https://campbellwindowfilm.com/locations-served/los-angeles/window-tinting/","https://campbellwindowfilm.com/services/decorative-window-film/","Facade Re-Imaging Los Angeles has a large inventory of aging commercial buildings whose exteriors no longer reflect the quality of the businesses operating inside them. Facade re-imaging uses specialty surface films to modernize the building's street presence at a fraction of the cost and timeline of conventional renovation.","","false","4"
"https://campbellwindowfilm.com/locations-served/los-angeles/window-tinting/","https://campbellwindowfilm.com/services/decorative-window-film/","Colored Window Film Retail brands and property owners looking to reinforce visual identity or add distinction to an otherwise unremarkable facade use colored window film to make glass an active part of the building's design language. Available in a wide range of finishes and tones.","","false","4"
"https://campbellwindowfilm.com/locations-served/los-angeles/window-tinting/","https://campbellwindowfilm.com/services/decorative-window-film/","Switchable Film Open-plan offices and healthcare facilities across Los Angeles increasingly rely on switchable film to create instant privacy on demand. The film shifts electronically from transparent to opaque, eliminating the need for blinds, partitions, or permanent frosted glass in spaces that need to serve multiple functions.","Switchable films for offices","false","4"
"https://campbellwindowfilm.com/locations-served/los-angeles/window-tinting/","https://campbellwindowfilm.com/services/decorative-window-film/","Decorative Window Film Frosted patterns, geometric designs, and textured finishes transform plain glass into a design element. Decorative film is widely used in Los Angeles restaurants, boutique offices, residential bathrooms, and creative studio spaces where visual interest and partial privacy are equally important.","Decorative Window Film","false","4"
"https://campbellwindowfilm.com/locations-served/los-angeles/window-tinting/","https://campbellwindowfilm.com/services/decorative-window-film/","Custom Graphics Los Angeles is a visual city, and storefronts, lobbies, and interiors that communicate brand identity effectively have a tangible competitive advantage. We design and install large-format graphics on glass, walls, and architectural surfaces for retail brands, creative agencies, entertainment companies, and corporate campuses across the city.","Custom graphics installed outside","false","4"
"https://campbellwindowfilm.com/locations-served/los-angeles/window-tinting/","https://campbellwindowfilm.com/services/decorative-window-film/","Architectural Resurfacing Older commercial buildings throughout Los Angeles often have dated or deteriorating glass surfaces that affect both appearance and performance. Architectural resurfacing film updates the look and improves thermal performance without triggering the cost and disruption of a full glass replacement project.","Person picking up","false","4"
"https://campbellwindowfilm.com/locations-served/san-diego/security-window-film/","https://campbellwindowfilm.com/services/decorative-window-film/","Glass Doors and Interior Partitions Enhances intrusion resistance and shatter safety on internal glass doors, conference room walls, and partitions while preserving modern, open workplace design.","","false","4"
"https://campbellwindowfilm.com/locations-served/san-diego/security-window-film/","https://campbellwindowfilm.com/services/decorative-window-film/","Government and Public Facilities Meets demanding safety requirements for municipal offices, courthouses, libraries, and federal facilities throughout the county. Built for durability, code compliance, and predictable performance under impact.","","false","4"
"https://campbellwindowfilm.com/locations-served/san-diego/security-window-film/","https://campbellwindowfilm.com/services/decorative-window-film/","Office Buildings and Commercial Spaces Strengthens ground-floor and lobby glazing in Downtown, UTC, Sorrento Valley, and Carmel Valley office buildings, protecting staff, equipment, data, and sensitive work areas across tech, biotech, defense, and professional services.","","false","4"
"https://campbellwindowfilm.com/locations-served/san-diego/security-window-film/","https://campbellwindowfilm.com/services/decorative-window-film/","School Entrances and Classrooms Reinforces glass entrances, vestibules, classroom doors, and sidelights across San Diego Unified, Poway Unified, and private schools throughout the county. Strengthens controlled access points and supports lockdown protocols without altering the welcoming, light-filled character.","","false","4"
"https://campbellwindowfilm.com/locations-served/san-diego/security-window-film/","https://campbellwindowfilm.com/services/decorative-window-film/","Retail Storefronts Reduces smash-and-grab exposure on Gaslamp Quarter, La Jolla Village, Mission Valley, and Fashion Valley storefronts while keeping merchandise fully visible to customers. Particularly important for jewelry stores, cannabis retailers, electronics shops, and luxury boutiques targeted by organized retail crime.","","false","4"
"https://campbellwindowfilm.com/locations-served/san-francisco/decorative-window-film/","https://campbellwindowfilm.com/services/decorative-window-film/","Clear Decorative Films Provides refined visual definition while preserving transparency and openness, making it ideal for San Francisco interiors where privacy is not required but a polished appearance on interior glass is still desired.","","false","4"
"https://campbellwindowfilm.com/locations-served/san-francisco/decorative-window-film/","https://campbellwindowfilm.com/services/decorative-window-film/","3M™ FASARA Decorative Films Premium architectural decorative films backed by 3M, engineered for long-term performance and consistent aesthetics across San Francisco commercial interiors, and professionally installed by authorized applicators for offices, hospitality spaces, healthcare environments, and retail interiors seeking a sophisticated architectural finish on interior glass.","Bathroom Glass Switchable","false","4"
"https://campbellwindowfilm.com/locations-served/san-francisco/decorative-window-film/","https://campbellwindowfilm.com/services/decorative-window-film/","Patterned & Geometric Films Adds subtle structure and visual separation to San Francisco interiors without overwhelming the space's design or altering glass functionality. Ideal for creative offices in SoMa, tech campuses and startup environments in Mission Bay, medical offices, and multi-tenant commercial buildings throughout the city.","Pattern display","false","4"
"https://campbellwindowfilm.com/locations-served/san-francisco/decorative-window-film/","https://campbellwindowfilm.com/services/decorative-window-film/","Gradient Window Films Transition from transparent to opaque across a single pane to create privacy zones while preserving openness and visibility. Frequently installed in San Francisco lobby glass, reception areas, tech offices, and executive workspaces, where partial privacy is preferred over a fully frosted appearance.","","false","4"
"https://campbellwindowfilm.com/locations-served/san-francisco/decorative-window-film/","https://campbellwindowfilm.com/services/decorative-window-film/","Frosted Window Films One of the most requested decorative privacy window film options for San Francisco offices and commercial interiors. Frosted film diffuses light evenly across interior glass, creating privacy in conference rooms, executive suites, healthcare offices, and collaborative workspaces while maintaining the open feel common in modern San Francisco architecture.","","false","4"
"https://campbellwindowfilm.com/locations-served/san-francisco/window-tinting/","https://campbellwindowfilm.com/services/decorative-window-film/","Facade Re-Imaging Modernize commercial exteriors with updated surface films and finishes. A cost-effective way to refresh building appearance and improve curb appeal without structural renovation.","","false","4"
"https://campbellwindowfilm.com/locations-served/san-francisco/window-tinting/","https://campbellwindowfilm.com/services/decorative-window-film/","Colored Window Film Colored window film adds visual impact while improving privacy and branding opportunities. Available in multiple finishes, it can be customized to complement nearly any design style.","","false","4"
"https://campbellwindowfilm.com/locations-served/san-francisco/window-tinting/","https://campbellwindowfilm.com/services/decorative-window-film/","Switchable Film Switchable film instantly changes glass from clear to private using smart technology. It’s a popular solution for conference rooms, healthcare facilities, and contemporary office spaces.","Switchable films for offices","false","4"
"https://campbellwindowfilm.com/locations-served/san-francisco/window-tinting/","https://campbellwindowfilm.com/services/decorative-window-film/","Decorative Window Film Decorative window film adds style, texture, and privacy to interior and exterior glass surfaces. It’s an ideal solution for offices, storefronts, conference rooms, and modern commercial spaces.","Decorative Window Film","false","4"
"https://campbellwindowfilm.com/locations-served/san-francisco/window-tinting/","https://campbellwindowfilm.com/services/decorative-window-film/","Custom Graphics Create branded environments with custom graphics designed for glass, walls, and architectural surfaces. From logos to large-scale visual displays, these solutions help businesses stand out and create a stronger visual presence.","Custom graphics installed outside","false","4"
"https://campbellwindowfilm.com/locations-served/san-francisco/window-tinting/","https://campbellwindowfilm.com/services/decorative-window-film/","Architectural Resurfacing Refresh aging or dated glass and architectural surfaces with specialty film solutions that update appearance and extend the life of existing installations, without full replacement.","Person picking up","false","4"
"https://campbellwindowfilm.com/locations-served/santa-monica/window-tinting/","https://campbellwindowfilm.com/services/decorative-window-film/","Facade Re-Imaging Facade reimagining and renovation transform outdated building exteriors with modern finishes and updated design elements. It’s a cost-effective way to improve curb appeal and refresh commercial properties.","","false","4"
"https://campbellwindowfilm.com/locations-served/santa-monica/window-tinting/","https://campbellwindowfilm.com/services/decorative-window-film/","Colored Window Film Colored window film adds visual impact while enhancing privacy and branding opportunities. Available in a variety of finishes, it can be customized to fit nearly any design style.","","false","4"
"https://campbellwindowfilm.com/locations-served/santa-monica/window-tinting/","https://campbellwindowfilm.com/services/decorative-window-film/","Switchable Film Switchable film instantly turns glass from clear to private with smart technology. It’s perfect for conference rooms, healthcare facilities, and modern commercial spaces.","Switchable films for offices","false","4"
"https://campbellwindowfilm.com/locations-served/santa-monica/window-tinting/","https://campbellwindowfilm.com/services/decorative-window-film/","Decorative Window Film Decorative window film adds style, texture, and privacy to interior and exterior glass. It’s an ideal solution for offices, storefronts, conference rooms, and commercial spaces.","Decorative Window Film","false","4"
"https://campbellwindowfilm.com/locations-served/santa-monica/window-tinting/","https://campbellwindowfilm.com/services/decorative-window-film/","Custom Graphics Create branded environments with custom graphics designed for glass, walls, and architectural surfaces. From logos to full-scale visual displays, these solutions help businesses stand out.","Custom graphics installed outside","false","4"
"https://campbellwindowfilm.com/locations-served/santa-monica/window-tinting/","https://campbellwindowfilm.com/services/decorative-window-film/","Architectural Resurfacing Restore worn or outdated surfaces without the cost of full replacement. Architectural resurfacing provides a durable, modern finish that improves appearance and extends the life of existing materials.","Person picking up","false","4"
